{
  "schema_version": "1.0.0",
  "run_id": "real-latex-build-001",
  "manuscript_snapshot_sha256": "aaaaaaaaaaaaaaaaaaaaaaaaaaaaaaaaaaaaaaaaaaaaaaaaaaaaaaaaaaaaaaaa",
  "source_tree_ref": "source",
  "source_tree_sha256": "9f04449352eb2582ac1fb4d3fc2568a90b25c3dc8de778d5236401fb81472e80",
  "requires_pdf": true,
  "build_state": "COMPILED",
  "process_receipt": {
    "executable": "latexmk.EXE",
    "executable_version": "Latexmk, John Collins, 9 March 2026. Version 4.88",
    "argv": [
      "latexmk.EXE",
      "--disable-installer",
      "-norc",
      "-gg",
      "-pdf",
      "-interaction=nonstopmode",
      "-halt-on-error",
      "-file-line-error",
      "-recorder",
      "-no-shell-escape",
      "-outdir=private-output",
      "main.tex"
    ],
    "operating_system": "Windows",
    "tex_engine": "pdflatex",
    "return_code": 0,
    "duration_ms": 1297,
    "timed_out": false,
    "shell": false,
    "shell_escape": false,
    "started_at": "2026-07-22T03:42:42Z",
    "finished_at": "2026-07-22T03:42:43Z",
    "receipt_sha256": "7e7e1cb921ae63cf7ff7c987a23342e0ffcb7c7b2dd7d66ab1b325664e15de78"
  },
  "log_ref": "build/build.log",
  "log_sha256": "cb413c67af5ec23374e8d64b991a91a4f467f2850a4c00a66691c45776278acd",
  "recorder_ref": "build/main.fls",
  "recorder_sha256": "5a7d864ed905702cec5f8959cd28f209019bfe8c97c695307f8d8a2da66c6577",
  "pdf": {
    "path": "build/main.pdf",
    "sha256": "81695e74fa1ee191dc808303f9c68cd9f01cd1c35064957d8b7abdfe3299b235",
    "byte_size": 24321
  },
  "build_receipt_sha256": "b02ddbe2a95579bb1ca1e2c0d92d8706e8bdf9abaf03dcadd445efab2573d315"
}
